{
  "$schema": "https://json-schema.org/draft/2020-12/schema",
  "$id": "https://aizign.dev/spec/protocol/v1/request-envelope.schema.json",
  "title": "Aizign Protocol v1 request envelope",
  "type": "object",
  "additionalProperties": false,
  "required": ["protocol", "version", "requestId", "kind", "payload"],
  "properties": {
    "protocol": { "const": "aizign" },
    "version": { "const": 1 },
    "requestId": { "type": "string", "pattern": "^[A-Za-z0-9][A-Za-z0-9._:-]{0,127}$" },
    "kind": {
      "type": "string",
      "enum": ["hello", "workflow.signal.submit", "workflow.signal.reconcile"]
    },
    "payload": { "type": "object" }
  },
  "allOf": [
    {
      "if": { "properties": { "kind": { "const": "hello" } } },
      "then": { "properties": { "payload": { "type": "object", "additionalProperties": false } } }
    },
    {
      "if": { "properties": { "kind": { "const": "workflow.signal.submit" } } },
      "then": { "properties": { "payload": { "$ref": "workflow-signal-submit.request.schema.json" } } }
    },
    {
      "if": { "properties": { "kind": { "const": "workflow.signal.reconcile" } } },
      "then": { "properties": { "payload": { "$ref": "workflow-signal-reconcile.request.schema.json" } } }
    }
  ]
}
