{"protocol":"aizign","version":1,"requestId":"req-signal-repair","kind":"workflow.signal.submit","payload":{"expected":{"workflowId":"wf-example-01","assignmentId":"as-repair-01","attemptId":"attempt-repair-01","role":"implementation","artifactRevision":"rev-c0ffee-repair","candidateDigest":{"algorithm":"sha256","hex":"bbbbbbbbbbbbbbbbbbbbbbbbbbbbbbbbbbbbbbbbbbbbbbbbbbbbbbbbbbbbbbbb"},"sourceEventId":"evt-0002"},"signal":{"eventId":"evt-0004","workflowId":"wf-example-01","assignmentId":"as-repair-01","attemptId":"attempt-repair-01","role":"implementation","artifactRevision":"rev-c0ffee-repair","candidateDigest":{"algorithm":"sha256","hex":"bbbbbbbbbbbbbbbbbbbbbbbbbbbbbbbbbbbbbbbbbbbbbbbbbbbbbbbbbbbbbbbb"},"sourceEventId":"evt-0002","kind":"repair_submitted","findingCount":2,"artifactRef":"repair:fedcba9876543210","evidenceDigest":{"algorithm":"sha256","hex":"cccccccccccccccccccccccccccccccccccccccccccccccccccccccccccccccc"}}}}
