{"protocol":"aizign","version":1,"requestId":"req-signal-02","kind":"workflow.signal.submit","payload":{"expected":{"workflowId":"wf-example-01","assignmentId":"as-review-01","role":"review","artifactRevision":"rev-c0ffee"},"signal":{"eventId":"evt-0002","workflowId":"wf-example-01","assignmentId":"as-review-01","role":"review","artifactRevision":"rev-c0ffee","kind":"review_findings","findingCount":2,"artifactRef":"review:0123456789abcdef"}}}
