{"protocol":"aizign","version":1,"requestId":"req-reconcile-01","kind":"workflow.signal.reconcile","payload":{"signal":{"eventId":"evt-0001","workflowId":"wf-example-01","assignmentId":"as-implementation-01","attemptId":"attempt-fixture","role":"implementation","artifactRevision":"rev-c0ffee","candidateDigest":{"algorithm":"sha256","hex":"aaaaaaaaaaaaaaaaaaaaaaaaaaaaaaaaaaaaaaaaaaaaaaaaaaaaaaaaaaaaaaaa"},"kind":"implementation_ready"}}}
