{"protocol":"aizign","version":1,"requestId":"req-signal-03","kind":"workflow.signal.submit","payload":{"expected":{"workflowId":"wf-example-01","assignmentId":"as-implementation-01","attemptId":"attempt-fixture","role":"implementation","artifactRevision":"rev-c0ffee","candidateDigest":{"algorithm":"sha256","hex":"aaaaaaaaaaaaaaaaaaaaaaaaaaaaaaaaaaaaaaaaaaaaaaaaaaaaaaaaaaaaaaaa"}},"signal":{"eventId":"evt-0003","workflowId":"wf-example-01","assignmentId":"as-implementation-01","attemptId":"attempt-fixture","role":"implementation","artifactRevision":"rev-c0ffee","candidateDigest":{"algorithm":"sha256","hex":"aaaaaaaaaaaaaaaaaaaaaaaaaaaaaaaaaaaaaaaaaaaaaaaaaaaaaaaaaaaaaaaa"},"kind":"blocked","shortErrorCode":"TOOL_UNAVAILABLE"}}}
